{
  "receipt_version": "0.1.0",
  "receipt_id": "b3bdcd8c-5b81-479b-83a1-42225f7682d2",
  "time": {
    "requested_at": "2026-03-02T00:00:00Z",
    "decided_at": "2026-03-02T00:00:00Z",
    "completed_at": "2026-03-02T00:00:00Z"
  },
  "trace": {
    "trace_id": "ca240231-f8b7-4b57-a272-0e1da4a87786",
    "step": 1
  },
  "actor": {
    "type": "agent",
    "id": "agent:demo",
    "display": "Demo Agent",
    "session_id": "sess-demo-001"
  },
  "notary": {
    "runtime": "IX-Agent-Notary",
    "version": "0.1.0-dev",
    "instance_id": "notary-local-001",
    "environment": "local"
  },
  "action": {
    "kind": "tool.invoke",
    "tool": "filesystem",
    "operation": "file.write",
    "parameters": {
      "path": "docs/demo.txt",
      "bytes": 10,
      "content_redacted": true
    },
    "parameters_hash": "sha256:HYthq7weCadmlK6OoW2Oe32VxLT6b7I8p0vUo3XRa8k"
  },
  "policy": {
    "policy_id": "demo-policy-001",
    "decision": "allow",
    "reason": "path allowed (docs/*)",
    "rules": [
      {
        "rule_id": "allow-docs",
        "effect": "allow",
        "explanation": "allow docs/* writes"
      }
    ],
    "approvals": [],
    "context_hashes": {
      "requested_path": "sha256:frzhpSwKNG4kKjNH5JX_yLJt5mYZoJKUt0MZqJ2yLTQ"
    }
  },
  "result": {
    "status": "success",
    "summary": "Allowed filesystem file.write (simulated).",
    "output": {
      "path": "docs/demo.txt",
      "written": true,
      "content_redacted": true
    },
    "output_hash": "sha256:OrhWojHzXx3bjWL4KzM-bjG2cXGxI3OTQ8w5U5w5GL4"
  },
  "integrity": {
    "canonicalization": "RFC8785-JCS",
    "hash": {
      "alg": "sha-256",
      "encoding": "base64url"
    },
    "signature": {
      "alg": "ed25519",
      "key_id": "dev-key-001",
      "value": "mhy7NDWZd40wjRwwU5vp87uMZiUL9btVl_1VHEmHYkaakK4esxfQxrbYk81hrmQiJXLzsaApqKEGOimjoQxQAQ"
    }
  }
}
